{"schema_version":"case-v1","id":"env-precedence-001","pair_id":"env-precedence","family":"env-precedence","title":"Environment variable overrides explicit configuration","repository":"bat","scenario":{"fault":"implementation reads EXITBIND_EVAL_MODE before the explicit configuration file even though the accepted precedence rule says the file wins","accepted_invariants":["explicit configuration value takes precedence over EXITBIND_EVAL_MODE","ordinary functional execution only proves a mode was selected"],"execution":{"mode":"fixture","argv":["{binary}","--case","env-precedence-001","--json"]}},"ground_truth":{"method":"synthetic fixture runs the same ordinary functional check and a separate precedence preservation check","expected_outcome":"REFUSED","expected_reason":"SEMANTIC_INVARIANT_LOST","expected_exit_code":2,"holytail_expected":"LOSS"}}
