{"schema_version":"case-v1","id":"stale-check-control-001","pair_id":"stale-check","family":"valid-control","title":"Passing check remains on same subject","repository":"bat","scenario":{"fault":"none; check and accepted subject hashes are identical","accepted_invariants":["check evidence binds to the exact accepted subject"],"execution":{"mode":"fixture","argv":["{binary}","--case","stale-check-control-001","--json"]}},"ground_truth":{"method":"deterministic subject hash equality","expected_outcome":"READY","expected_reason":"ACCEPTED","expected_exit_code":0,"holytail_expected":"NOT_APPLICABLE"}}
