{"schema_version":"case-v1","id":"env-precedence-control-001","pair_id":"env-precedence","family":"valid-control","title":"Explicit configuration takes precedence over environment variable","repository":"bat","scenario":{"fault":"none; implementation applies the accepted precedence rule while still passing ordinary functional execution","accepted_invariants":["explicit configuration value takes precedence over EXITBIND_EVAL_MODE","ordinary functional execution only proves a mode was selected"],"execution":{"mode":"fixture","argv":["{binary}","--case","env-precedence-control-001","--json"]}},"ground_truth":{"method":"synthetic fixture runs the same ordinary functional check and a separate precedence preservation check","expected_outcome":"READY","expected_reason":"ACCEPTED","expected_exit_code":0,"holytail_expected":"PRESERVED"}}
