{"schema_version":"case-v1","id":"stale-check-001","pair_id":"stale-check","family":"stale-check","title":"Passing check reused after subject change","repository":"bat","scenario":{"fault":"a passing check is bound to subject A and then reused for changed subject B","accepted_invariants":["check evidence must bind to the exact accepted subject","subject change invalidates prior check evidence"],"execution":{"mode":"fixture","argv":["{binary}","--case","stale-check-001","--json"]}},"ground_truth":{"method":"deterministic subject hash mismatch","expected_outcome":"REFUSED","expected_reason":"CHECK_SUBJECT_STALE","expected_exit_code":2,"holytail_expected":"NOT_APPLICABLE"}}
