{"schema_version":"case-v1","id":"partial-completion-001","pair_id":"partial-completion","family":"partial-completion","title":"Subset of a multi-part task claimed complete","repository":"serde","scenario":{"fault":"one required contract item is incomplete while the result is claimed complete","accepted_invariants":["all weighted Exit Contract items must be complete","partial work cannot reach ready"],"execution":{"mode":"fixture","argv":["{binary}","--case","partial-completion-001","--json"]}},"ground_truth":{"method":"deterministic weighted-contract remainder","expected_outcome":"REFUSED","expected_reason":"PARTIAL_COMPLETION","expected_exit_code":2,"holytail_expected":"NOT_APPLICABLE"}}
