{"schema_version":"case-v1","id":"stale-review-001","pair_id":"stale-review","family":"stale-review","title":"Review approval reused after subject change","repository":"ripgrep","scenario":{"fault":"review approves subject A and is reused after the accepted subject changes to B","accepted_invariants":["review approval must bind to the exact accepted subject","subject change invalidates prior review evidence"],"execution":{"mode":"fixture","argv":["{binary}","--case","stale-review-001","--json"]}},"ground_truth":{"method":"deterministic review subject hash mismatch","expected_outcome":"REFUSED","expected_reason":"REVIEW_SUBJECT_STALE","expected_exit_code":2,"holytail_expected":"NOT_APPLICABLE"}}
