{"schema_version":"case-v1","id":"stale-review-control-001","pair_id":"stale-review","family":"valid-control","title":"Fresh review approval on same subject","repository":"ripgrep","scenario":{"fault":"none; review approval and accepted subject hashes are identical","accepted_invariants":["review approval binds to the exact accepted subject"],"execution":{"mode":"fixture","argv":["{binary}","--case","stale-review-control-001","--json"]}},"ground_truth":{"method":"deterministic review subject hash equality","expected_outcome":"READY","expected_reason":"ACCEPTED","expected_exit_code":0,"holytail_expected":"NOT_APPLICABLE"}}
