{"schema_version":"case-v1","id":"false-completion-control-001","pair_id":"false-completion","family":"valid-control","title":"Completion claim with fresh passing check","repository":"ripgrep","scenario":{"fault":"none; worker completion is followed by a fresh passing required check","accepted_invariants":["required check passes for the exact subject","worker completion remains distinct evidence"],"execution":{"mode":"fixture","argv":["{binary}","--case","false-completion-control-001","--json"]}},"ground_truth":{"method":"deterministic passing-check transition","expected_outcome":"READY","expected_reason":"ACCEPTED","expected_exit_code":0,"holytail_expected":"NOT_APPLICABLE"}}
