{"schema_version":"case-v1","id":"reported-observed-001","pair_id":"reported-observed","family":"reported-vs-observed","title":"Caller reports success without local observation","repository":"bat","scenario":{"fault":"caller-reported success is supplied but no valid locally observed check exists","accepted_invariants":["reported evidence cannot substitute for required observed evidence","missing observation remains non-ready"],"execution":{"mode":"fixture","argv":["{binary}","--case","reported-observed-001","--json"]}},"ground_truth":{"method":"deterministic evidence-kind absence","expected_outcome":"BLOCKED","expected_reason":"OBSERVATION_MISSING","expected_exit_code":3,"holytail_expected":"NOT_APPLICABLE"}}
