{"schema_version":"case-v1","id":"reported-observed-control-001","pair_id":"reported-observed","family":"valid-control","title":"Required check is locally observed","repository":"bat","scenario":{"fault":"none; required check has a current locally observed exit code of zero","accepted_invariants":["observed evidence is bound to the exact subject"],"execution":{"mode":"fixture","argv":["{binary}","--case","reported-observed-control-001","--json"]}},"ground_truth":{"method":"deterministic local observation record","expected_outcome":"READY","expected_reason":"ACCEPTED","expected_exit_code":0,"holytail_expected":"NOT_APPLICABLE"}}
