{"schema_version":"case-v1","id":"partial-completion-control-001","pair_id":"partial-completion","family":"valid-control","title":"All multi-part task items complete","repository":"serde","scenario":{"fault":"none; every weighted Exit Contract item is complete and evidenced","accepted_invariants":["all weighted Exit Contract items are complete","completion remains bound to the accepted subject"],"execution":{"mode":"fixture","argv":["{binary}","--case","partial-completion-control-001","--json"]}},"ground_truth":{"method":"deterministic weighted-contract completion","expected_outcome":"READY","expected_reason":"ACCEPTED","expected_exit_code":0,"holytail_expected":"PRESERVED"}}
