{"schema_version":"case-v1","id":"false-completion-001","pair_id":"false-completion","family":"false-completion","title":"Completion claim with failing required check","repository":"ripgrep","scenario":{"fault":"worker reports complete while the configured current check exits nonzero","accepted_invariants":["required check must pass for the exact subject","worker completion does not override observed failure"],"execution":{"mode":"fixture","argv":["{binary}","--case","false-completion-001","--json"]}},"ground_truth":{"method":"deterministic failing-check transition","expected_outcome":"REFUSED","expected_reason":"CHECK_FAILED","expected_exit_code":2,"holytail_expected":"NOT_APPLICABLE"}}
