{"schema_version":"case-v1","id":"semantic-loss-001","pair_id":"semantic-loss","family":"semantic-loss","title":"Build remains green after accepted invariant is removed","repository":"serde","scenario":{"fault":"implementation removes an accepted compatibility invariant while ordinary checks remain green","accepted_invariants":["historical format remains readable","accepted public behavior is preserved"],"execution":{"mode":"fixture","argv":["{binary}","--case","semantic-loss-001","--json"]}},"ground_truth":{"method":"predeclared invariant with deterministic executable oracle","expected_outcome":"REFUSED","expected_reason":"SEMANTIC_INVARIANT_LOST","expected_exit_code":2,"holytail_expected":"LOSS"}}
