{"schema_version":"case-v1","id":"semantic-loss-control-001","pair_id":"semantic-loss","family":"valid-control","title":"Accepted invariant is preserved","repository":"serde","scenario":{"fault":"none; implementation and compatibility oracle preserve the accepted invariant","accepted_invariants":["historical format remains readable","accepted public behavior is preserved"],"execution":{"mode":"fixture","argv":["{binary}","--case","semantic-loss-control-001","--json"]}},"ground_truth":{"method":"predeclared invariant with deterministic executable oracle","expected_outcome":"READY","expected_reason":"ACCEPTED","expected_exit_code":0,"holytail_expected":"PRESERVED"}}
